evidence_type,evidence_file,what_it_shows,interpretation
Final Kaggle notebook,notebooks/demo_081716_xgb.ipynb,"Runs the final compact XGBoost branch on Kaggle and writes Submission_XGB_0_81716.csv","This is the teacher-facing reproduction path for the verified public-best submission."
Final script reproduction,code/reproduce_081716_xgb.py,"Runs the same preprocessing, KMeansSMOTE resampling, XGBoost training, and submission export as the notebook","The public-best branch is reproducible without relying on exploratory notebook cells."
Focused neighborhood search,experiments/tables/xgb_neighborhood_search.csv,"Compares nearby tree count, learning rate, depth, sampling, and regularization variants with row-level and group-aware CV","The branch lies inside a competitive parameter region rather than being an unsupported isolated setting."
Stage reconstruction,experiments/tables/xgb_branch_reconstruction.csv,"Measures compact preprocessing, IsolationForest diagnostic, feature pruning, and strict group-aware audit","The public-best branch came from a sequence of pipeline decisions, with feature pruning being the clearest local gain."
Submission milestone history,report/paper_summary.json,"Records public scores from early XGBoost, revised XGBoost, stack-assisted XGBoost, and final public-best XGBoost","The final submission is the endpoint of an XGBoost exploration path with public feedback."
